<?xml version="1.0" encoding="utf-8"?>
<categoryMap
	xmlns:xsi="http://www.w3.org/2001/XMLSchema-instance" 
	xsi:noNamespaceSchemaLocation="../schemas/categorymaps.xsd">
<!-- 
	Nerwip - Named Entity Extraction in Wikipedia Pages
	Copyright 2011-17 Vincent Labatut et al.
	
	This file is part of Nerwip - Named Entity Extraction in Wikipedia Pages.
	
	Nerwip - Named Entity Extraction in Wikipedia Pages is free software: you can 
	redistribute it and/or modify it under the terms of the GNU General Public License 
	as published by the Free Software Foundation, either version 2 of the License, or
	(at your option) any later version.
	 
	Nerwip - Named Entity Extraction in Wikipedia Pages is distributed in the hope 
	that it will be useful, but WITHOUT ANY WARRANTY; without even the implied warranty 
	of MERCHANTABILITY or FITNESS FOR A PARTICULAR PURPOSE. See the GNU General Public 
	License for more details.
	
	You should have received a copy of the GNU General Public License
	along with Nerwip - Named Entity Extraction in Wikipedia Pages.  
	If not, see <http://www.gnu.org/licenses/>.
 -->

	<accept>
		<category name="ACADEMIA">
			<key>/astronomy</key>
			<key>/biology</key>
			<key>/chemistry</key>
			<key>/computer</key>
			<key>/conferences</key>
			<key>/education</key>
			<key>/engineering</key>
			<key>/geography</key>
			<key>/geology</key>
			<key>/library</key>
			<key>/measurement_unit</key>
			<key>/physics</key>
			<key>/spaceflight</key>
		</category>
		
		<category name="ARCHITECTURE">
			<key>/architecture</key>
		</category>
		
		<category name="ART">
			<key>/book</key>
			<key>/comic_books</key>
			<key>/exhibitions</key>
			<key>/fashion</key>
			<key>/fictional_universe</key>
			<key>/film</key>
			<key>/music</key>
			<key>/opera</key>
			<key>/theater</key>
			<key>/visual_art</key>
		</category>
		
		<category name="BUSINESS">
			<key>/amusement_parks</key>
			<key>/automotive</key>
			<key>/aviation</key>
			<key>/bicycles</key>
			<key>/boats</key>
			<key>/business</key>
			<key>/cvg</key>
			<key>/dataworld</key>
			<key>/food</key>
			<key>/rail</key>
			<key>/transportation</key>
			<key>/travel</key>
		</category>
		
		<category name="LAW">
			<key>/law</key>
		</category>
		
		<category name="MEDIA">
			<key>/broadcast</key>
			<key>/celebrities</key>
			<key>/meteorology</key>
			<key>/periodicals</key>
			<key>/radio</key>
			<key>/royalty</key>
			<key>/tv</key>
		</category>
		
		<category name="MEDICINE">
			<key>/medicine</key>
		</category>
		
		<category name="MILITARY">
			<key>/military</key>
		</category>
		
		<category name="POLITICS">
			<key>/government</key>
		</category>
		
		<category name="RELIGION">
			<key>/religion</key>
		</category>
		
		<category name="SPORT">
			<key>/american_football</key>
			<key>/baseball</key>
			<key>/basketball</key>
			<key>/boxing</key>
			<key>/chess</key>
			<key>/cricket</key>
			<key>/ice_hockey</key>
			<key>/martial_arts</key>
			<key>/olympics</key>
			<key>/skiing</key>
			<key>/soccer</key>
			<key>/sports</key>
			<key>/tennis</key>
		</category>
	</accept>
	
	<reject>
		<startsWith>
			<key>/award</key>
			<key>/base</key>
			<key>/common</key>
			<key>/digicams</key>
			<key>/event</key>
			<key>/freebase</key>
			<key>/games</key>
			<key>/interests</key>
			<key>/influence</key>
			<key>/internet</key>
			<key>/language</key>
			<key>/location</key>
			<key>/media_common</key>
			<key>/m</key>
			<key>/organization</key>
			<key>/people</key>
			<key>/projects</key>
			<key>/protected_sites</key>
			<key>/symbols</key>
			<key>/time</key>
			<key>/type</key>
			<key>/user</key>
			<key>/zoos</key>
		</startsWith>
		
		<endsWith>
			<key>/kwtopic</key>
			<key>/topic</key>
		</endsWith>
	</reject>

</categoryMap>
